t1.csv,55,Wonderful service! Hotel Monteleone is a wonderful traditional New Orleans institution. It is in a fantastic location only a block away from world-famous Bourbon Street but you cant hear any of the noise associated with that. It is located on Rue Royal which was steps away from some of the citys best restaurants: Brennans and Court of Two Sisters. Finally its just a block away from Canal street and the famed St. Charles streetcar. My family and I loved the charm and ambiance of the hotel especially the rooftop pool. The staff were all very accomodating would stay here again in a heartbeat! The room was clean and large and felt roomy for 4 people. We stayed in a room near the elevator and ice machine but it wasnt too bad. Loved everything about this hotel! ,http://en.wikipedia.org/wiki/Canal_Street%2C_New_Orleans,http://en.wikipedia.org/wiki/New_Orleans,http://en.wikipedia.org/wiki/Bourbon_Street,http://en.wikipedia.org/wiki/Streetcars_in_New_Orleans,http://en.wikipedia.org/wiki/Royal_Street,_New_Orleans,http://en.wikipedia.org/wiki/Roof,,,,,,,,,,,
t1.csv,56,Classic New Orleans The Monteleone isnt a perfect hotel but there are some really terrific things about it. We love the lobby and spinning carousel bar....truly classic new orleans. The rooms are small as others have written but how much time do you spend in your room? They are very clean and the beds are extremely comfortable even if it might be getting close to time to rework the look of those draperies. We also love the rooftop pool for hot afternoons. The French Quarter is always loud and you will get some street noise even on the upper floors but thats pretty much every hotel in the area. The plus is that you are in spitting distance of all the great restaurants and bars as well as the street car. Overall this is a perfect hotel to experience what makes the city unique. ,http://en.wikipedia.org/wiki/Hotel,http://en.wikipedia.org/wiki/New_Orleans,http://en.wikipedia.org/wiki/Hotel_Monteleone,,,,,,,,,,,,,,,
t1.csv,57,Great Getaway Just returned from a girls getaway to New Orleans. The hotel is beautiful conveniently located and the staff is superb. The front desk had no problems with getting us 3 rooms adjacent to each other. They also didnt quibble when we needed to split the bill 6 ways. Elke the concierge was great and the bell staff was wonderful. The Rue Royal location is great for shopping and it is in a quieter portion of the quarter which is nice. The rooms are smaller more like a European hotel and the layout can be confusing but it is an older hotel. It is immaculately kept. Spa Aria is fabulous Le Cafe had a good and speedy breakfast and Carousel bar is a good place to hang out. The pool was also nice. My only complaint is that the toilet flush was a bit loud. ,http://en.wikipedia.org/wiki/Hotel,http://en.wikipedia.org/wiki/Spa,http://en.wikipedia.org/wiki/Bar_%28establishment%29,http://en.wikipedia.org/wiki/New_Orleans,http://en.wikipedia.org/wiki/Coffeehouse,http://en.wikipedia.org/wiki/Receptionist,http://en.wikipedia.org/wiki/Royal_Street,_New_Orleans,,,,,,,,,,
t1.csv,58,Great Location We have stayed here 3 times now and this time appreciated the newly renovated rooms. The rooms are all now double glazed which makes for a very peacful sleep in the middle of Sydney. Each time we have found the staff to be friendly and rooms always clean. Nice large king beds and showers with good pressureThe location is great - a 10 min walk to the heart of Pitt STreet Mall or the the entertainment district china town art gallery and the clubs and cafes of Oxford Street . ,http://en.wikipedia.org/wiki/Sydney,http://en.wikipedia.org/wiki/Pitt_Street_Mall,http://en.wikipedia.org/wiki/Oxford_Street%2C_Sydney,gallery,http://en.wikipedia.org/wiki/Chinatown,,,,,,,,,,,,,
t1.csv,59,someone stole me I was there with my wife for two days. The room was very small of course not like the photo dirty and no minibar. Someone stole my perfum from the room and when i asked to the staff they told me to ask the day we day we leave to make me a discount. That day just one hour before leaving amsterdam they told me that the hotel never take care about objets in the room and  I just can go to the police. I?ve been 5 times in amsterdam and i have never seen something like this.last visit on August 2005. ,http://en.wikipedia.org/wiki/Amsterdam,http://en.wikipedia.org/wiki/Theft,http://en.wikipedia.org/wiki/2005,August,,,,,,,,,,,,,,
t1.csv,60,Fab end to 2006 Even better start to 2007       Great waves ,http://en.wikipedia.org/wiki/2006,http://en.wikipedia.org/wiki/2007,http://en.wikipedia.org/wiki/2007,February,en.wikipedia.org/wiki/Wave,,,,,,,,,,,,,
t1.csv,61,Didnt want to leave My wife 3 yo daugther and I spent 5 blissful days at Copamarina starting on January 5th. We booked a deluxe ocean front room. Which was clean. Many of the other rooms on the property have partial ocean views so those wishing to save some money can book garden view rooms without missing out. We took the all inclusive meal plan based on the online menu and the fact that the hotel would happily provide box lunches. This way we could take our lunch and explore the puerta del sol. We had dinner each night in their restaurant Alexandra which was very good most nights and fantastic on 2 occasions! Service was always professional and the staff was only too happy to accommodate special requests. Lunch was usually a nice fresh grilled piece of fish with veggies at Las Palmas. The grounds are immaculate the beach cleaned every morning and we found the staff helpful and quite friendly. We purposely traveled the week after Christmas break and were rewarded to find the resort uncrowded. Local families and others from the States made up the majority of visitors. Most local families were curious to know how we found out about this place since its off the beaten path which adds to the specialness of Copamarina. Yes the resort is about 2 hours from San Juan but thats the reward. For those with long flights into San Juan you may want to consider spending a night or two in San Juan before heading South. The resort has 5 pools two infant and 3 regular. BTW lunch can be delivered poolside!! We spent a good deal of time in the pools so the issues of sea grass in the ocean didnt bother us. There is a staircase into the water at the end of the dock so if you want to swim beyond the seagrass you can. We played on the beach and took the hobie cat out sailing everyday. The price of which is included in the all inclusive package.One highlight was the day 5 dolphins swam with us as we sailed to guiligans Island. Overall we had a wonderful time and Copamarina is the type of resort that you can actively travel the local area or just hang out on the beach. Our only disappointment was the bedroom pillows. For the price we would have expected plush pillows. Instead the ones in our room were hard and lumpy. Would we go back? We didnt want to leave. Next time maybe well bring our own pillows! ,http://en.wikipedia.org/wiki/Hotel,http://en.wikipedia.org/wiki/Restaurant,http://en.wikipedia.org/wiki/Vegetable,http://en.wikipedia.org/wiki/Seagrass,http://en.wikipedia.org/wiki/Fish_%28food%29,http://en.wikipedia.org/wiki/Lunch,January,Christmas,http://en.wikipedia.org/wiki/San_Juan,_Puerto_Rico,http://en.wikipedia.org/wiki/United_States,http://en.wikipedia.org/wiki/Dolphin,http://en.wikipedia.org/wiki/Swimming_pool,http://en.wikipedia.org/wiki/Staircase,http://en.wikipedia.org/wiki/Family_(biology),http://en.wikipedia.org/wiki/Pillow,,
t1.csv,62,Hated almost all of it I was so excited about going to an all-inclusive resort because my parents had gone to one and all I heard was how good it was so my mom found this hotel and we booked it. From the moment we got there it was bad. The front desk was rude to us didnt want to answer our questions. The rooms were dirty and smelled of mold. Luckly the second day I found a pool where a lot of people didnt go so I stayed there the rest of the time. The resturants were bad. They wanted to copy Amerian food by having an italian place and a tex-mex place. The food was gross. I think the best day I had was when it rained and I played bingo and won some Domonican coffee. Anyone thinking of going there please dont. I spent my money on a trip I wish I could take back. Choose somewhere else to go. The ocean was dirty dead fish floating around. Went in water once and had to get out quick because I saw a dead fish floating by. ,http://en.wikipedia.org/wiki/All-inclusive_resort,http://en.wikipedia.org/wiki/Tex-Mex,http://en.wikipedia.org/wiki/Coffee,http://en.wikipedia.org/wiki/Italian_cuisine,http://en.wikipedia.org/wiki/Fall_front_desk,http://en.wikipedia.org/wiki/Swimming_pool,http://en.wikipedia.org/wiki/Fish,,,,,,,,,,,
t1.csv,63,Loved the hotel but not the location We had a party of six stay at the San Gallo Palace Hotel. They gave us a corner of three rooms all to our selves. Very clean very well appointed rooms. Large bathrooms with both shower and tub (one of our rooms had a shower only but it was a large shower with massage jets). The staff was very helpful and spoke excellent English. We ate at Alfredos three or four nights. Excellent food and nice wait staff.The draw back of the Hotel San Gallo Palace is its location. We had to take taxis almost everywhere because it is a distance from Florence center. We did walk some but after a day of sightseeing and walking all day we did not feel like hiking back to the hotel hence the taxis.If you dont mind spending money on taxis I would definitely recommend the San Gallo Palace Hotel. ,http://en.wikipedia.org/wiki/United_Kingdom,http://en.wikipedia.org/wiki/Florence,http://en.wikipedia.org/wiki/Massage,http://en.wikipedia.org/wiki/Taxicab,http://en.wikipedia.org/wiki/Hotel,,,,,,,,,,,,,
t1.csv,64,You Are A Person Not Just A Room Number We stayed Feb. 9th. Cruised the islands for 11 days and then stayed another 7 days. We asked for the same room. The view was great. 4808 ocean front. These people are the best. I always stay at a different hotel every time I go to Hawaii but from now on my only hotel will be the Ocean Tower. I have stayed at the Hyatt and other 5 star hotels only to find that you are just a room number and you are on your own. At the Ocean Tower you are treated special everyday. If you get a chance to go to Hawaii be sure to stay at the Ocean Tower. From the manager front desk to house keeping you will be made to feel like you are someone very special. This hotel and employees are the best. Hope to return next year. Thanks S. Bringle and T. Valdez ,http://en.wikipedia.org/wiki/Hawaii,http://en.wikipedia.org/wiki/Hotel,http://en.wikipedia.org/wiki/Star_(classification),,,,,,,,,,,,,,,
t1.csv,65,Good value for the rate confortable stay I like that this hotel is smaller but has the facilities of a larger hotel. My primary reason for choosing Loews is they accept pets. Theyre also very relaxed about the dog unlike a lot of other hotels. The rules are limited to those that seem to be reasonable rather than some hotels that hand you a 10 page contract to sign to have a dog in the room. Loews also does not charge an extra pet fee.The rooms are good - very spacious good amenities with a big reading chair and ottoman large desk and TV armoire big bathroom. The decor is a *tiny* bit dated but I like it. Everything was very clean during my entire stay for 4 nights.The restaurant patio and pool area are very nice. Small and quiet I loved eating outside by the pool in the warm evenings. All of the hotel staff were very friendly professional and accommodating. Id rate this hotel highly on their staff. My only complaint is that nowhere on my reservation or the website did it reference the valet ONLY parking which is $24 per day. Best to find a street space 2 blocks away but what a pain! They literally park your car 10 feet away. This is the one thing they would need to change to make me come back on my monthly week-long trips to LA. Because an extra $100 for parking is a complete waste of my money. ,fee,http://en.wikipedia.org/wiki/Ottoman_%28furniture%29,http://en.wikipedia.org/wiki/Bathroom,http://en.wikipedia.org/wiki/Dog,http://en.wikipedia.org/wiki/Parking_lot,,,,,,,,,,,,,
t1.csv,66,Cool hotel great service Stayed at the London for two nights in Feb with my husband and we were both really impressed. The staff upgraded us to a suite for our wedding anniversary and a bottle of wine was waiting for us in the room - nice touch. Really really friendly staff too. Best bit though was the room - for NY standards well by any standards it was huge with a separate sitting area - handy if one of you is jetlagged and the other wants to watch tv! We didnt have an amazing view but it was NY enough skyscrapers etc and to be honest it didnt really matter because the room was so good. Small attention to detail was good too - earplugs slippers nice toiletries etc etc - we stayed in the Soho Grand for a couple of days too and you dont get nearly as much value for money. Location is easy youre a five minute walk from 5th Ave Rockefeller centre theatre district etc or its just a stroll up a couple of blocks to central park. If you want breakfast out of the hotel there are lots of diner places around the corner. The London - thoroughly recommended and would go back. which is good if one of you is suffering jet lag and wants to goFor NY the room was huge ,http://en.wikipedia.org/wiki/Rockefeller_Center,http://en.wikipedia.org/wiki/Central_Park,http://en.wikipedia.org/wiki/Best_Bit,http://en.wikipedia.org/wiki/Diner,http://en.wikipedia.org/wiki/Skyscraper,breakfast,,,,,,,,,,,,
t1.csv,67,disappointed due to construction We had stayed at the Renaissance before 2 years ago and thought it was the best location and hotel at Times Square. With high expectations we assumed that nothing would have changed.Were we wrong!!! Currently there is renovating going on at the hotelwhich should be completed by October. There is a narrow entrance in entering the lobby before riding up the elevator to the main lobby area. There was blaring music that was not appropriate when we entered the building. We are Marriott Reward members and had requested a refrigerator extra pillows toiletries and a high level floor. It took 5 hours for us to receive our room!! The room did not have the items we requested by concierge email so we had to request again with the front desk. There was not an area to wait for our roomdue to the lack of seating and the other people also waiting for their room. So we went to the Westinwhich we stayed at last year and waited in their large waiting area.The room was nice when we got there but it was not very homey. It looked like a businessmans rooms. There was no flat screen tv no free bottle water ( the Westin offers) and it was noisy due to the construction. The ice machine area on each floor is supposed to have vending machines but none were visible.The fitness room used to have a basket of fruit for those that workout but this amenity was no longer available. The treadmills were old and needed updating. The buttons on one of the elevators did not light up to indicate which floor you selected.You would have to hope that after pushing the button that the elevator would take you to your floor.We still love the location and the hotel will probably look nice after the renovation but for those that have to endure the process- we should have notified at reservation of the construction-the management should have reduced the rate or reduced the points needed to stay due to construction.-where are the apples at the front desk?? all the other Renaissance hotels still make it available for its guests ,http://en.wikipedia.org/wiki/Elevator,http://en.wikipedia.org/wiki/Concierge,http://en.wikipedia.org/wiki/Renaissance_Hotels,http://en.wikipedia.org/wiki/Pillow,http://en.wikipedia.org/wiki/Refrigerator,http://en.wikipedia.org/wiki/Times_Square,http://en.wikipedia.org/wiki/Email,http://en.wikipedia.org/wiki/Westin_Hotels,http://en.wikipedia.org/wiki/Marriott_International,http://en.wikipedia.org/wiki/Television,http://en.wikipedia.org/wiki/Vending_machine,http://en.wikipedia.org/wiki/Ice_machine,http://en.wikipedia.org/wiki/Elevator,lobby,,,,
t1.csv,68,Truely outstanding service     ,,,,,,,,,,,,,,,,,,
t1.csv,69,OK for a night or two Perfect acceptable if drab. Its right in the middle of the Copley area the rooms were clean although it was very hard to find (its off Stuart at the entrance to a parking lot). Given the price it did the job. ,http://en.wikipedia.org/wiki/Parking_lot,Copley,http://en.wikipedia.org/wiki/Stuart,_Virginia,,,,,,,,,,,,,,
t1.csv,70,The hotel sucks We booked at Liberty but we had to go to hotel Brian to check in and our room was in this hotel as well. We booked a double room but got a twin one the first thing which didnt go as planned. There was also told we had an own toilet and shower this wasnt the case. The room was dirty the breakfast was crappy and the fact we had to do our own dishes was the most ridiculous thing one can imagine in a hotel. The only good thing was the location but there are also other hotels with a good location they will never see me at this hotel again. Dont go there! ,http://en.wikipedia.org/wiki/Toilet,breakfast,,,,,,,,,,,,,,,,
t1.csv,71,About what I expected I read some reviews before I booked a room at the Parc St. Charles so I knew what I was in store for. I think the really bad reviews come from people that pay over $100 for a room there. I only paid $55 a night and it was worth the price. The elevator situation was funny because it worked sometimes and other times it didnt but they have TWO elevators so no big deal. People who complain about that are stupid....two elevators..jeez. Anyway we got into town really early around 7am so we stopped by there and sure enough they let us check in even though we werent suppose to until 4pm!!! I was very happy about that. The staff was courteous and the place was a bit run down but it didnt smell bad and the rooms were clean. It reminded me of a 4 star hotel that had not been taken care of or repaired properly. ,http://en.wikipedia.org/wiki/Elevator,http://en.wikipedia.org/wiki/Concierge,,,,,,,,,,,,,,,,
t1.csv,72,It was okay My husband and I go to New Orleans every year for our anniversary. We have never stayed in the same hotel twice and this one was okay. It is in an ideal location and the coffee/sandwich shop next door is our favorite.As for the room itself it was small but pretty comfortable. I do think they could vacuum a little more in the rooms and in the halls. The walls are pretty thin; we could hear everything that went on in the next room.The courtyard was really lovely (no bird poop at all the staff is very nice. If youre on a budget and dont mind a 2 1/2 star hotel this is the place for you. ,http://en.wikipedia.org/wiki/Sandwich,http://en.wikipedia.org/wiki/New_Orleans,http://en.wikipedia.org/wiki/Coffee,http://en.wikipedia.org/wiki/Vacuum,http://en.wikipedia.org/wiki/Hotel,,,,,,,,,,,,,
t1.csv,73,My personal preference -more sunlight and a better lounge. Just got back from New Orleans. Our stay at the Hotel Monteleone was just fine. The room was nice no complaints. Make sure you ask for a room with a view (may be an upgrade certain wings of the hotel building are U shaped and the room windows face in toward each other. Everything about the hotel was very pretty I just would have liked to stay in a hotel with more windows and sunlight and a nicer lounge area. The carousel bar was pretty but small and the spinning I could do without!!! Im really not complaining but to me a clean room is fine its the lobby lounge bar area that really make a hotel. We stayed with friends and wed meet at a different hotel for a drink instead of our own before heading out. The Omni on St. Louis and the Sonesta on Bourbon are places to check out if you enjoy a little relaxation and a nice cocktail before or after heading out into the fun of New Orleans!Go to Mr. Bs across the street for lunch a GREAT restaurant with a real old time business lunch feel. ,http://en.wikipedia.org/wiki/Hotel_Monteleone,http://en.wikipedia.org/wiki/New_Orleans,http://en.wikipedia.org/wiki/Sun,http://en.wikipedia.org/wiki/Bar_(establishment),http://en.wikipedia.org/wiki/St._Louis,_Missouri,Bourbon,Omni,Sonesta,http://en.wikipedia.org/wiki/Restaurant,lunch,,,,,,,
t1.csv,74,Historic Monteleone - beautiful and perfect location The hotel is beautiful and the location cant be beat. Book a room larger than just the standard room. The rooms are nicely furnished and beds are comfy. Everything was perfect during our stay but we did not have to valet park and the line Sunday morning for those retreiving their cars was quite long. The pool are is very nice and the pool was heated above 90 degress - it was in the 50s. The location is ideal. ,http://en.wikipedia.org/wiki/Hotel_Monteleone,,,,,,,,,,,,,,,,,
t1.csv,75,Lovely Old World Charm I was in New Orleans attending a conference and did not have a choice in which hotel I stayed. This hotel turned out to be ideal. It is an older hotel with a lot of charm and character (I usually go for the more modern hotel when I travel in American cities). The location is perfect too right in the middle of the French Quarter - a couple of minutes to walk to Bourbon St but just far enough away from the noise. The street itself has several good restaurants gift shops coffee shops etc. I walked to the famous Cafe Du Monde easily from here. I would definitely stay in this hotel again. ,http://en.wikipedia.org/wiki/Restaurant,http://en.wikipedia.org/wiki/Hotel,http://en.wikipedia.org/wiki/New_Orleans,http://en.wikipedia.org/wiki/Coffeehouse,http://en.wikipedia.org/wiki/Bourbon_Street,http://en.wikipedia.org/wiki/French_Quarter,http://en.wikipedia.org/wiki/Caf%C3%A9_du_Monde,,,,,,,,,,,
t1.csv,76,Think Twice Before Staying.... This letter is to inform you of our negative experience with the hotelvalet service. Upon receiving our vehicle from valet we were making sure our belongings were still there. We discovered that the emergency cash that was hidden in my car was missing. Only a person that put a lot of effort into digging through my car could have found this hiding place. After speaking with the transportation director he informed us that the valet is not responsible for our vehicle. We tried to self park the car upon arriving to the hotel but we were told we had no choice but to valet. This makes us suspicious that the hotel may condone the act of theft and possibly even promote the valets to thoroughly search each car to ??ee what they can find??as a ??onus?? Although the manager spoke with us he did not seem very concerned at getting to the bottom of the situation. He seemed more concerned about getting us out of the lobby as to not cause a seen in front of other guest. After speaking with several other people from Baton Rouge about our experience we were told other horror stories concerning Hotel Monteleone?? valet service that had taken place this Mardi Gras as well as for the Kenny Chesney concert just a few months ago. You can be assured that we will never return to this hotel and will be spreading the word to as many people as possible about our experience and the experiences we have learned about from our friends concerning your hotel. To add insult to injury we had to pay $30 for valet to rob us. ,http://en.wikipedia.org/wiki/Hotel,http://en.wikipedia.org/wiki/Valet_parking,http://en.wikipedia.org/wiki/Automobile,http://en.wikipedia.org/wiki/Kenny_Chesney,http://en.wikipedia.org/wiki/Valet,http://en.wikipedia.org/wiki/Theft,http://en.wikipedia.org/wiki/Baton_Rouge%2C_Louisiana,http://en.wikipedia.org/wiki/Mardi_Gras,,,,,,,,,,
