t1.csv,22,Perfect hotel The hotel is unique. Rooms are designed with perfect style. You feel like staying in somebodys home - not in hotel. I tried a dozen hotels in ADAM - this on is the best. Perfect balance between quite nice street and short distance to everything. ,http://en.wikipedia.org/wiki/Hotel,http://en.wikipedia.org/wiki/Amsterdam,http://en.wikipedia.org/wiki/Design,,,,,,,,,,,,,,,
t1.csv,23,Had a perfect stay perfect. Stayed just 1 evening. Booked a Junior Suite but was upgraded without even requesting upon arrival. Made specific requests in my email booking and the hotel bent over backwards to accomodate. Room was beautiful bathroom (especially shower) fantastic. The staff were just so so friendly. Really helpful and understanding. Hotel location is perfect. Barcelona has a serious traffic problem so being just a touch out from the centre was perfect. No problem with noise from harbour sound insulation anywas was amazing. Quite simply cannot fault hotel in any way and would definitely return next time I am in Barcelona. Another thing. I am quite a down to earth guy but for sure one does NOT have to meet the stereotypical image of a Businessman to be treated like a lord here. All appear to be considered equal as it should be. ,http://en.wikipedia.org/wiki/Barcelona,http://en.wikipedia.org/wiki/Email,http://en.wikipedia.org/wiki/Barcelona,http://en.wikipedia.org/wiki/Traffic_congestion,,,,,,,,,,,,,,
t1.csv,24,perfect for us!!! I rely heavily on reviews within this forum..so I thought I would add mine on the Hampton Inn in the Garden District. It was perfect for us...my daughter and I were traveling to Tulane and I was looking for accomadations between downtown and the school. Service and Hotel: The staff was very friendly and went out of their way to be helpful. We arrived at about 10:30 for check in and they were not ready for us...but quickly found us a room. The room was clean enought...but the really great thing was how comfortable the bed was. It had 6 comfy useable pillows and a down comforter covered with a duvet...as most of us do not spend a lot of time in the room ..this great bed and hot shower were just perfect.It is about a 2 mile distance to Tulane which was perfect for a walk....Within the area is a Rite Aid to pick up incidentals  The Superior Grill which has great tex mex and huge magaritas Columns is 2 blocks away with a great bar and really nice Sunday Brunch Cannons is just up the street...The Hampton Inn worked really well for mom and daughter wanting to see a little more than the french quarter...although we have done that too.T ,http://en.wikipedia.org/wiki/Hotel,http://en.wikipedia.org/wiki/Rite_Aid,http://en.wikipedia.org/wiki/Hampton_Inn,http://en.wikipedia.org/wiki/Garden_District%2C_New_Orleans,http://en.wikipedia.org/wiki/Comforter,http://en.wikipedia.org/wiki/Bed,http://en.wikipedia.org/wiki/Pillow,http://en.wikipedia.org/wiki/Duvet,http://en.wikipedia.org/wiki/Tulane/Gravier,_New_Orleans,,,,,,,,
t1.csv,25,Sleepless......... We arrived in Seattle after a long flight from London and our first impression of the Sheraton was very good. The external facade was impressive the reception bright  spacious and airy and we received a warm welcome.Unfortunately once we got to our Club Level Room things began to go downhill. The room whilst spacious and clean looked tired and outdated the colour scheme being shades of beige. The bathroom was small and the bathtub was about a foot deep and practically useless. However the worst was yet to come. After having a meal in the Daily Grill which was fairly good we went to bed. That is when the doors started slamming............all night! The door mechanisms failed to work so when everybody entered or exited their rooms the door slammed. You could hear doors slamming 10 rooms away and it coninued into the early hours of the morning. Hence we did not have a proper nights sleep for 3 nights.When I raised the issue with the front desk they knew immediately what I was coplaining about so why has this not been resolved? This just shows contempt for the customer.This is unacceptable for any standard of hotel never mind a four star establishment. I received a fifty dollar per night credit but frankly would have preferred to sleep.In conclusion I would not recommend this hotel until they take the comfort of their guests more seriously and sort out the doors.In truth it was an average hotel with a significant problem. ,http://en.wikipedia.org/wiki/London,http://en.wikipedia.org/wiki/Seattle,bathroom,http://en.wikipedia.org/wiki/Door_furniture,http://en.wikipedia.org/wiki/Hotel,,,,,,,,,,,,,
t1.csv,26,Good Experience I am a very frequent business traveller to Manhattan but this was the first time I had stayed here. I was pleasantly surprised - the toom was fairly large clean and the bathroom in excellent condition. Everything in the room worked. The bed was very comfortable and there was little or no noise (my room was on the 42nd floor). All in all a minor miracle considering where you are - one block from Times Square. And if you dont like the in-house food there are millions of options within a mile radius.Service - I liked the one touch service - you call one number to get access to all services rather than having to call room service housekeeping etc. separately. Some service gripes made me reduce my rating: my in-room dining cart and cutlery was not removed from room for an entire 24-hour period although multiple housekeeping staff would have seen it. Secondly as a business traveller I travel with two laptops but I had to pay twice for Internet access once for each computer. Central service express just told me to put my cart in the hallway and in relation to the Internet issue said that that was just the way it was. Really superior customer service would have apologized for rhe first issue and waived the extra Internet fee. ,fee,http://en.wikipedia.org/wiki/Manhattan,http://en.wikipedia.org/wiki/Cutlery,http://en.wikipedia.org/wiki/Internet,http://en.wikipedia.org/wiki/Times_Square,bathroom,http://en.wikipedia.org/wiki/Laptop,,,,,,,,,,,
t1.csv,27,Polite Mayfair Hotel This hotel really does seem an incredible deal in upscale Mayfair with the Ritz the Connaught and Claridges all nearby neighbors. My partner and I checked with the hotel directly through their website and got a great rate including an English breakfast for under $350--that with the exchange rate so terribly bad these days. The front desk service was incredibly efficient and polite; the maid service was prompt; the turn-down service a nice touch; and the very nice inclusive breakfast was the perfect way to start a day of sight-seeing. As a tourist visiting for four days the Chesterfield really offered a glimpse into what a sophisticated upscale hospitable city London can be. The hotel is convenient to the Green Park Underground stop and with Shepherds Market offering a variety of shops and cafes nearby and Bond Street and Oxford Street also within easy walking distance one could spend an entire day shopping very close to your hotel. And while youre staying at the Chesterfield go ahead and have dinner nearby at The Square--one of the best dinners we have had anywhere. Just a great experience in this part of town staying at the Chesterfield. We hope to be back someday. ,http://en.wikipedia.org/wiki/Exchange_rate,http://en.wikipedia.org/wiki/The_Connaught_%28hotel%29,http://en.wikipedia.org/wiki/Claridge%27s,http://en.wikipedia.org/wiki/The_Ritz_London_Hotel,http://en.wikipedia.org/wiki/Mayfair,http://en.wikipedia.org/wiki/Website,http://en.wikipedia.org/wiki/Full_breakfast,http://en.wikipedia.org/wiki/Fall_front_desk,http://en.wikipedia.org/wiki/Green_Park_tube_station,http://en.wikipedia.org/wiki/Chesterfield,,,,,,,,
t1.csv,28,Extraordi-Neri It would be easy to run down a hotel when the whole of your visit to supposedly sunny Barcelona is blighted by incessant rain. However it would be difficult to fault the Neri. The service was extremely friendly and the room was fantastic. Its location in the heart of the Barri Gotic is convenient for getting around and also for local bars and restaurants (the Cuines Santa Caterina is well worth a visit). The interior modernity of the hotel comes as a surprise when viewed from outside - it is a clever blend of old and new. Not that its the be-all of a holiday but the wi-fi service worked extremely well. Would definitely recommend. ,http://en.wikipedia.org/wiki/Gothic_Quarter%2C_Barcelona,http://en.wikipedia.org/wiki/Wi-Fi,http://en.wikipedia.org/wiki/Barcelona,http://en.wikipedia.org/wiki/Interior_design,http://en.wikipedia.org/wiki/Bar_(establishment),http://en.wikipedia.org/wiki/Restaurant,,,,,,,,,,,,
t1.csv,29,Great Breakfast During our four days stay in Hyatt the most memorable thing was their breakfast buffet (which was included for the hotel guests). The breakfast serves western traditional breakfast food with the additions of tasty Asian choices (there are a lot of Asian tourists staying in the hotel). The staff was very friendly and efficient. The room we stayed at wasnt impressive. It was rather small. There is no fridge. We rented a fridge from the hotel for about $15. The fridge was tiny. We liked the pool and hot tubs. Every night there was live music entertainment at the pool area. The spa facility was nice but pretty pricy. Overall we had a pleasant experience staying at Hyatt in Waikiki would recommend it to others. ,http://en.wikipedia.org/wiki/Breakfast,http://en.wikipedia.org/wiki/Swimming_pool,http://en.wikipedia.org/wiki/Refrigerator,http://en.wikipedia.org/wiki/Buffet,http://en.wikipedia.org/wiki/Spa,http://en.wikipedia.org/wiki/Waikiki,http://en.wikipedia.org/wiki/Entertainment,,,,,,,,,,,
t1.csv,30,great hotel amazing breakfast We loved this hotel. The decorbathroombedding and most important the great spread of breakfast. The breakfast alone was worth twenty Euro and I miss it very much. The staff was nice and spoke great english. The only negative is the location. The bus ride was like 15 minutes. I highy reccomend Quatro Amici near the station for a great lunch and dinner. Have a great hot chocolate at Rivore and eat all the gelato you can all over. ,http://en.wikipedia.org/wiki/English,http://en.wikipedia.org/wiki/Breakfast,lunch,dinner,http://en.wikipedia.org/wiki/Gelato,http://en.wikipedia.org/wiki/Hot_chocolate,,,,,,,,,,,,
t1.csv,31,Still the Best Stayed at this hotel last year and had an excellent stay so when heading to Paris again at the beginning on January 08 had no second thoughts on where to stay.The service and staff were excellent. The room was clean and well appointed. The staff even gave us help when having problems checking in flight online. A wonderful stay and if Im back in Paris again next year it will be back here. ,http://en.wikipedia.org/wiki/Paris,january,flight,,,,,,,,,,,,,,,
t1.csv,32,The most fabulous stay!       The bathroom ,bathroom,,,,,,,,,,,,,,,,,
t1.csv,33,Good Value A bit hard to find at first but good value for the money. We tried to check out at 7:15 AM but no one was at the front desk (closed between 11 PM and 7 AM). Called the main number from our room to find out that the individual was running a little late; we did make our train. ,http://en.wikipedia.org/wiki/Fall_front_desk,train,,,,,,,,,,,,,,,,
t1.csv,34,excellent hotel After a long flight from Pennsylvania to Hawaii we were pleased with the quality of this hotel. Free Internet service in the rooms was a huge plus as we were able to tell family  friends that we made it safely. Nice pool. Large clean room. Excellent service. Hotel stored our bags for the day (for a fee of course) and had no trouble finding htem once we returned. Cabs readily available. Reception gave good directions for taking bus to see Pearl Harbor. ,fee,http://en.wikipedia.org/wiki/Pennsylvania,http://en.wikipedia.org/wiki/Internet,http://en.wikipedia.org/wiki/Hawaii,http://en.wikipedia.org/wiki/Swimming_pool,http://en.wikipedia.org/wiki/Receptionist,http://en.wikipedia.org/wiki/Pearl_Harbor,,,,,,,,,,,
t1.csv,35,No problems great location This was my first time booking a hotel in NYC. After reading lots of reviews for lots of hotels some of which sounded scary I opted for a relatively expensive but safe bet. The Hotel Metro matched my expectations. There were no problems at all. I had a single room with a king size bed. It was small but comfortable. The amenities (bed towels toiletries TV etc.) were those of an average hotel like a Holiday Inn. The staff were professional but not particularly friendly or helpful. The location is really great half a block from the subway at Herald Square plus there are quite a few places to eat around the hotel especially Korean food. ,http://en.wikipedia.org/wiki/Holiday_Inn,http://en.wikipedia.org/wiki/Herald_Square,http://en.wikipedia.org/wiki/New_York_City,bed,http://en.wikipedia.org/wiki/Towel,http://en.wikipedia.org/wiki/Television,,,,,,,,,,,,
t1.csv,36,Think Twice We were greeted by an outrageously surly registration clerk. Our party of three rooms was split between the hotels two towers so each room visit meant 35 floors down one tower crossing the lobby and going 35 floors up the other tower. The beds were rock hard. The rooms at the same rate were dramatically different in size shape and amenities. Our room did have a spectacular view. The mini bar is not stocked by the maids its stocked later in the day by a second surprise visitor. The cost for two bowls of cereal a juice and two coffees in the hotel restaurant was $45. The concierge was helpful. The rooms felt clean albeit quite worn. Our room had pink spots all over the floor. The hotel is not especially well located it is a jaunt from Grand Central station and a bit of a long cab ride from Penn Station. The area empties out on weekends and there are few restaurants to walk to. The first 30 floors apparently belong to the building next door so prepare for long elevator rides. Everyone had his or her hand out and even ice requires hotel employee delivery. We noticed our tv audio was restricted to a very low maximum. ,http://en.wikipedia.org/wiki/Cereal,http://en.wikipedia.org/wiki/Elevator,http://en.wikipedia.org/wiki/Restaurant,http://en.wikipedia.org/wiki/Mini-bar,http://en.wikipedia.org/wiki/Grand_Central_Terminal,bed,juice,http://en.wikipedia.org/wiki/Concierge,http://en.wikipedia.org/wiki/Pennsylvania_Station_(New_York_City),http://en.wikipedia.org/wiki/Television,,,,,,,,
t1.csv,37,Fantastic hotel and location. Stayed at London Bridge hotel for 2 nights with family including 2 children aged 13 and 12 years.Excellent location 2 minutes walk from tube station yet quiet at night allowing a good nights sleep.Rooms were very cleangood beds and en suite.Breakfast was excellent with good choice on both hot and cold plates.Friendly attentive staff.Best hotel Ive stayed in in several visits to London. ,http://en.wikipedia.org/wiki/London,http://en.wikipedia.org/wiki/London_Underground,bed,breakfast,,,,,,,,,,,,,,
t1.csv,38,Great Location  I have stayed in several Radisson SAS Hotels (Paris Amsterdam Prague etc) and this one is defiantly near the top of the heap.I stayed in an well appointed King Junior Suite with amazing views over the Berliner Dom Museumsinsel (Museum Island)and the old East German Parliament building Palast der Republik or Palace of the Republic (which after many years is finally being pulled down)The Hotel is modern sleek and provides excellent modern amenities. The cylindrical aquarium that is in the lobby of the hotel is truly amazing and can be viewed from the elevator as you are travelling to your floor.The Hotel is well located on the River Spree and is close to Hackescher Markt and the adjoining S Bahn which runs all the ways out to Flughafen Schonefeld (Airport) on the S9 Line. There are also some great restaurants in the Hackescher Markt area.I would definitely recommend this hotel to anyone who is considering staying in Berlin whether for business or Leisure. ,http://en.wikipedia.org/wiki/Amsterdam,http://en.wikipedia.org/wiki/Spree,http://en.wikipedia.org/wiki/Berlin_Hackescher_Markt_station,http://en.wikipedia.org/wiki/S-Bahn,http://en.wikipedia.org/wiki/Aquarium,http://en.wikipedia.org/wiki/Berlin,http://en.wikipedia.org/wiki/Elevator,http://en.wikipedia.org/wiki/Radisson_Hotels,http://en.wikipedia.org/wiki/Berlin_Cathedral,http://en.wikipedia.org/wiki/Berlin_Sch%C3%B6nefeld_Airport,http://en.wikipedia.org/wiki/Paris,http://en.wikipedia.org/wiki/Palace_of_the_Republic_%28Berlin%29,http://en.wikipedia.org/wiki/People%27s_Chamber,http://en.wikipedia.org/wiki/Prague,http://en.wikipedia.org/wiki/Museum_Island,,,
t1.csv,39,Great place for honeymoon!       the last performance- the Topeng Tua dance..SCARY!! ,http://en.wikipedia.org/wiki/Topeng_dance,http://en.wikipedia.org/wiki/Honeymoon,,,,,,,,,,,,,,,,
t1.csv,40,Inconsistent We arrived at the Eliot after spending a wonderful night at the Lenox. The Eliot is closer to The Boston Conservatory so that is where I initially wanted to stay but there was no room the first night so we stayed at the Lenox. The rather small but charming lobby of the Eliot was somewhat chaotic as a large group was checking out. It was raining when we arrived in the evening and there was no doorman to greet us or bellman to help us with the bags. There were steps to enter the hotel and steps to go down to the lobby and carrying the luggage was not easy.The room was nicely decorated. Clean bathrooms cute window seats very charming. The beds were very comfortable.In room internet access was a $10 charge which I think should have been included.Turn down service was offered nightly. The neighborhood is very convenient to shopping (Newberry Street) and is very close to both Berklee and The Boston Conservatory.Upon checking out once again...no help. Lugging bags to the street and hailing a cab ourselves.After arriving home I received $10.00 fee adjustment on my bill for a luggage tag. I was told I had taken this from the room. I can assure you I have no luggage tag. I have asked for this fee to be removed and was told that it would be but as of today it still remains. ,http://en.wikipedia.org/wiki/Baggage,http://en.wikipedia.org/wiki/Boston_Conservatory,lobby,http://en.wikipedia.org/wiki/Bouncer_(doorman),bathroom,http://en.wikipedia.org/wiki/Newbury_Street,fee,,,,,,,,,,,
t1.csv,41,barcelona     ,http://en.wikipedia.org/wiki/Barcelona,,,,,,,,,,,,,,,,,
t1.csv,42,Mediocre at best for what you pay for If you are not forced to stay at this hotel by your job because of a conference...stay away by all means. At 235 euro per room its a mediocre attempt to provide luxury with unfriendly staff not above average amenities ok rooms but with no touch of class. And if you are visiting Barcelona you most likely want to see the magnificent sights in the center this hotel is at least a 30min drive from the center. Its in a non residential new area of the town near the harbor that after 7pm you rarely see anybody go by. All in all...wouldnt stay there again ,http://en.wikipedia.org/wiki/Barcelona,hotel,,,,,,,,,,,,,,,,
t1.csv,43,Fantastic Experience       The view from our balcony ,http://en.wikipedia.org/wiki/Balcony,,,,,,,,,,,,,,,,,
t1.csv,44,Wonderful location employees facilities........ We arrived six hours late due to flight problems and checked in at midnight. We asked for the highest floor possible since we had ocean-front reservations. Was told that the 5th floor was the best available but to check back next day around noon. Was moved up to 12th floor and had splendid views from our balcony. Room was small which we expected from other reviews BUT very clean  attractive. We NEVER had the first problem with anything or anyone there. I have stayed next door for about 3 times what we paid. I am returning a year from March and will never stay anywhere else unless The Circle is sold out. My advice to anyone considering this hotel is grab it quick (except for a year from March). ,flight,March,,,,,,,,,,,,,,,,
t1.csv,45,What a great way to spend New Years!       Gorgeous beach! ,http://en.wikipedia.org/wiki/New_Years_Eve,beach,,,,,,,,,,,,,,,,
t1.csv,46,it was okay this hotel was average at best. the staff was nice but the service was slow and sometimes bad. the room was ok but a little dingy. restaurants were average... this is a good place if you dont want to stay more than 4-5 days in san juan. if longer splurge on a nicer place. ,http://en.wikipedia.org/wiki/San_Juan%2C_Puerto_Rico,http://en.wikipedia.org/wiki/Restaurant,,,,,,,,,,,,,,,,
t1.csv,47,Mouldy mouldy mouldy!       The delightful bathroom! ,bathroom,,,,,,,,,,,,,,,,,
t1.csv,48,What a great hotel what a great friendly hotel!Carole was the most welcoming of the staff however all were friendly. The hotel room was clean tidy Very spacious and bathroom was good size.the hotel is in a good location and walking distances of all attractions if you dont mind a 20-30 min walk.good eating places too. try the black sheep for snack and the frontier for breakfast.the resturant was closed but definately going under refurb as i found out by pressing the wrong button in the lift and ending up in the basement.the staff were vey helpful and luggage can be stored. safe deposit boxes are giving free of charge. I felt totally safe walking around anytime.tip : take the shuttle bus from 42nd street to airport $15 bargin ,http://en.wikipedia.org/wiki/Airport,http://en.wikipedia.org/wiki/Baggage,bathroom,breakfast,http://en.wikipedia.org/wiki/Restaurant,http://en.wikipedia.org/wiki/Shuttle_bus_service,,,,,,,,,,,,
t1.csv,49,Decent place to stay before a cruise Do not hesitate to book this hotel before a cruise. Very nice accomidations- clean and comfy bedding. I do enjoy the Crowne Plaza lines attention to a good night sleep (complimentary ear plugs lavender linen spray and a sleeping mask).The dining was OK- service was slow but the food was decent. My husband had a stir fry entree that was quite good. I ordered a pepper soup which was good as well. If I go back I would enjoy a meal there again if I stayed at the hotel because...if you are there for anything aother reason there is NOTHING else to really do in San Pedro. My husband and I walked around the neighborhood in the morning. At times I was scared and would turn my rings around. Not sure if it was all that bad but I was not very comfortable. I would not feel safe heading out at night in the area. ,http://en.wikipedia.org/wiki/Food,http://en.wikipedia.org/wiki/Crowne_Plaza,http://en.wikipedia.org/wiki/Soup,http://en.wikipedia.org/wiki/Stir_frying,cruise,,,,,,,,,,,,,
t1.csv,50,Much more than was expected!       Looking down Royal Street ,http://en.wikipedia.org/wiki/Royal_Street%2C_New_Orleans,,,,,,,,,,,,,,,,,
t1.csv,51,Great stay!! Just came back from a 4 day trip to New Orleans the hotel has an excellent location on a quiet St. just 1 block to Bourbon St. there is a pharmacy and a grocery store next to it. as well as great restaurants Mr. Bs Brennans ACME oyster house ect. ect. The rooms are small but nicely decorated  clean and with a extra comfy beds. ,http://en.wikipedia.org/wiki/New_Orleans,http://en.wikipedia.org/wiki/Pharmacy,http://en.wikipedia.org/wiki/Bourbon_Street,http://en.wikipedia.org/wiki/Supermarket,http://en.wikipedia.org/wiki/Acme_Markets,http://en.wikipedia.org/wiki/Oyster_bar,,,,,,,,,,,,
t1.csv,52,Lovely beds! The bed took up most of the room but it was huge and comfortable! The room looked out over the buildings in the area which generally speaking is not the high point of the French Quarter its whats inside! The bathrooms were immaculate and marble good water pressure.Did not have much interaction with the staff but I requested turndown service and it was provided immediately. I went back to my room about 5 minutes after making the call and she was already there! Was not ever bothered in the mornings by housekeeping even on late ones.Last point - PERFECT location. Very close to everything delicious and good in the French Quarter. ,http://en.wikipedia.org/wiki/Marble,http://en.wikipedia.org/wiki/French_Quarter,undefined,,,,,,,,,,,,,,,
t1.csv,53,Very nice. Old hotel that has been redone. Rooms and bathrooms were smallish but comfortable. Service was very friendly and helpful. Doormen were great! Pool on roof was enjoyable Room keys didnt work majority of the time (went through 7 of them in 5 days). Missed room service one day but we were in and out repeatedly so it was understandable. Meals were pricey but food was excellent.In the middle of French Quarter and shops restaurants and clubs. One block from Canal St and trolley walking distance to riverfront with Aquarium casinos etc. Short cab ride to French Market area. Would certainly stay there again. ,http://en.wikipedia.org/wiki/Restaurant,French_Market,bathroom,room,http://en.wikipedia.org/wiki/Hotel,,,,,,,,,,,,,
t1.csv,54,Skip the spa The hotel is fabulous the spa...not so much.Booked pedicure online and still had to call to make appointment. Most expensive overrated service. Unorganized front desk and had better service and better polish at neighborhood asian salons. Also price on spa website is incorrect or I was overcharged. ,http://en.wikipedia.org/wiki/Pedicure,http://en.wikipedia.org/wiki/Hotel,spa,,,,,,,,,,,,,,,
